{
  "schema_version": 1,
  "source": {
    "file_key": "LGMlwNCoVdakZxDBvPKg1W",
    "root_node": "0:1",
    "retrieved_utc": "2026-10-02 05:20:33 UTC",
    "method": "Figma application connector get_metadata",
    "file_revision": "UNKNOWN",
    "canonical_scale": 1,
    "source_fonts": [
      "ChiKareGo2",
      "FindersKeepers"
    ],
    "font_redistribution": "UNKNOWN"
  },
  "status": "PARTIAL_EXTRACTION_NOT_CONFORMANCE",
  "components": [
    {
      "source_node": "1:6",
      "source_component": "Page title",
      "variant": "Page title",
      "classification": "NOT_USED",
      "reason": "Reference-sheet editorial title is not a product UI component.",
      "width": 695,
      "height": 36,
      "source_geometry_status": "EXTRACTED_METADATA",
      "detail_status": "UNKNOWN",
      "interaction_status": "UNKNOWN",
      "accessibility_status": "UNKNOWN",
      "asset_policy": "GEOMETRY_ONLY_UNTIL_LICENSE_REVIEW"
    },
    {
      "source_node": "73:8867",
      "source_component": "Misc.",
      "variant": "Placeholder",
      "classification": "REQUIRED",
      "width": 233,
      "height": 92,
      "source_geometry_status": "EXTRACTED_METADATA",
      "detail_status": "UNKNOWN",
      "interaction_status": "UNKNOWN",
      "accessibility_status": "UNKNOWN",
      "asset_policy": "GEOMETRY_ONLY_UNTIL_LICENSE_REVIEW"
    },
    {
      "source_node": "191:9042",
      "source_component": "Misc.",
      "variant": "Balloon body",
      "classification": "REQUIRED",
      "width": 108,
      "height": 60,
      "source_geometry_status": "EXTRACTED_METADATA",
      "detail_status": "UNKNOWN",
      "interaction_status": "UNKNOWN",
      "accessibility_status": "UNKNOWN",
      "asset_policy": "GEOMETRY_ONLY_UNTIL_LICENSE_REVIEW"
    },
    {
      "source_node": "191:9088",
      "source_component": "Misc./Beak",
      "variant": "Position=Right top",
      "classification": "REQUIRED",
      "width": 19,
      "height": 17,
      "source_geometry_status": "EXTRACTED_METADATA",
      "detail_status": "UNKNOWN",
      "interaction_status": "UNKNOWN",
      "accessibility_status": "UNKNOWN",
      "asset_policy": "GEOMETRY_ONLY_UNTIL_LICENSE_REVIEW"
    },
    {
      "source_node": "191:9090",
      "source_component": "Misc./Beak",
      "variant": "Position=Top left",
      "classification": "REQUIRED",
      "width": 17,
      "height": 18,
      "source_geometry_status": "EXTRACTED_METADATA",
      "detail_status": "UNKNOWN",
      "interaction_status": "UNKNOWN",
      "accessibility_status": "UNKNOWN",
      "asset_policy": "GEOMETRY_ONLY_UNTIL_LICENSE_REVIEW"
    },
    {
      "source_node": "191:9086",
      "source_component": "Misc./Beak",
      "variant": "Position=Left top",
      "classification": "REQUIRED",
      "width": 17,
      "height": 16,
      "source_geometry_status": "EXTRACTED_METADATA",
      "detail_status": "UNKNOWN",
      "interaction_status": "UNKNOWN",
      "accessibility_status": "UNKNOWN",
      "asset_policy": "GEOMETRY_ONLY_UNTIL_LICENSE_REVIEW"
    },
    {
      "source_node": "191:9089",
      "source_component": "Misc./Beak",
      "variant": "Position=Top right",
      "classification": "REQUIRED",
      "width": 16,
      "height": 17,
      "source_geometry_status": "EXTRACTED_METADATA",
      "detail_status": "UNKNOWN",
      "interaction_status": "UNKNOWN",
      "accessibility_status": "UNKNOWN",
      "asset_policy": "GEOMETRY_ONLY_UNTIL_LICENSE_REVIEW"
    },
    {
      "source_node": "191:9085",
      "source_component": "Misc./Beak",
      "variant": "Position=Bottom right",
      "classification": "REQUIRED",
      "width": 17,
      "height": 18,
      "source_geometry_status": "EXTRACTED_METADATA",
      "detail_status": "UNKNOWN",
      "interaction_status": "UNKNOWN",
      "accessibility_status": "UNKNOWN",
      "asset_policy": "GEOMETRY_ONLY_UNTIL_LICENSE_REVIEW"
    },
    {
      "source_node": "191:9084",
      "source_component": "Misc./Beak",
      "variant": "Position=Right bottom",
      "classification": "REQUIRED",
      "width": 20,
      "height": 19,
      "source_geometry_status": "EXTRACTED_METADATA",
      "detail_status": "UNKNOWN",
      "interaction_status": "UNKNOWN",
      "accessibility_status": "UNKNOWN",
      "asset_policy": "GEOMETRY_ONLY_UNTIL_LICENSE_REVIEW"
    },
    {
      "source_node": "191:9087",
      "source_component": "Misc./Beak",
      "variant": "Position=Bottom left",
      "classification": "REQUIRED",
      "width": 18,
      "height": 20,
      "source_geometry_status": "EXTRACTED_METADATA",
      "detail_status": "UNKNOWN",
      "interaction_status": "UNKNOWN",
      "accessibility_status": "UNKNOWN",
      "asset_policy": "GEOMETRY_ONLY_UNTIL_LICENSE_REVIEW"
    },
    {
      "source_node": "191:9083",
      "source_component": "Misc./Beak",
      "variant": "Position=Left bottom",
      "classification": "REQUIRED",
      "width": 18,
      "height": 17,
      "source_geometry_status": "EXTRACTED_METADATA",
      "detail_status": "UNKNOWN",
      "interaction_status": "UNKNOWN",
      "accessibility_status": "UNKNOWN",
      "asset_policy": "GEOMETRY_ONLY_UNTIL_LICENSE_REVIEW"
    },
    {
      "source_node": "193:10218",
      "source_component": "Misc./Balloon help",
      "variant": "Position=Left top",
      "classification": "REQUIRED",
      "width": 146,
      "height": 73,
      "source_geometry_status": "EXTRACTED_METADATA",
      "detail_status": "UNKNOWN",
      "interaction_status": "UNKNOWN",
      "accessibility_status": "UNKNOWN",
      "asset_policy": "GEOMETRY_ONLY_UNTIL_LICENSE_REVIEW"
    },
    {
      "source_node": "193:10212",
      "source_component": "Misc./Balloon help",
      "variant": "Position=Left bottom",
      "classification": "REQUIRED",
      "width": 147,
      "height": 73,
      "source_geometry_status": "EXTRACTED_METADATA",
      "detail_status": "UNKNOWN",
      "interaction_status": "UNKNOWN",
      "accessibility_status": "UNKNOWN",
      "asset_policy": "GEOMETRY_ONLY_UNTIL_LICENSE_REVIEW"
    },
    {
      "source_node": "193:10217",
      "source_component": "Misc./Balloon help",
      "variant": "Position=Right bottom",
      "classification": "REQUIRED",
      "width": 148,
      "height": 73,
      "source_geometry_status": "EXTRACTED_METADATA",
      "detail_status": "UNKNOWN",
      "interaction_status": "UNKNOWN",
      "accessibility_status": "UNKNOWN",
      "asset_policy": "GEOMETRY_ONLY_UNTIL_LICENSE_REVIEW"
    },
    {
      "source_node": "193:10215",
      "source_component": "Misc./Balloon help",
      "variant": "Position=Right top",
      "classification": "REQUIRED",
      "width": 147,
      "height": 73,
      "source_geometry_status": "EXTRACTED_METADATA",
      "detail_status": "UNKNOWN",
      "interaction_status": "UNKNOWN",
      "accessibility_status": "UNKNOWN",
      "asset_policy": "GEOMETRY_ONLY_UNTIL_LICENSE_REVIEW"
    },
    {
      "source_node": "193:10213",
      "source_component": "Misc./Balloon help",
      "variant": "Position=Bottom left",
      "classification": "REQUIRED",
      "width": 130,
      "height": 91,
      "source_geometry_status": "EXTRACTED_METADATA",
      "detail_status": "UNKNOWN",
      "interaction_status": "UNKNOWN",
      "accessibility_status": "UNKNOWN",
      "asset_policy": "GEOMETRY_ONLY_UNTIL_LICENSE_REVIEW"
    },
    {
      "source_node": "193:10214",
      "source_component": "Misc./Balloon help",
      "variant": "Position=Bottom right",
      "classification": "REQUIRED",
      "width": 130,
      "height": 89,
      "source_geometry_status": "EXTRACTED_METADATA",
      "detail_status": "UNKNOWN",
      "interaction_status": "UNKNOWN",
      "accessibility_status": "UNKNOWN",
      "asset_policy": "GEOMETRY_ONLY_UNTIL_LICENSE_REVIEW"
    },
    {
      "source_node": "193:10211",
      "source_component": "Misc./Balloon help",
      "variant": "Position=Top left",
      "classification": "REQUIRED",
      "width": 130,
      "height": 90,
      "source_geometry_status": "EXTRACTED_METADATA",
      "detail_status": "UNKNOWN",
      "interaction_status": "UNKNOWN",
      "accessibility_status": "UNKNOWN",
      "asset_policy": "GEOMETRY_ONLY_UNTIL_LICENSE_REVIEW"
    },
    {
      "source_node": "193:10216",
      "source_component": "Misc./Balloon help",
      "variant": "Position=Top right",
      "classification": "REQUIRED",
      "width": 130,
      "height": 89,
      "source_geometry_status": "EXTRACTED_METADATA",
      "detail_status": "UNKNOWN",
      "interaction_status": "UNKNOWN",
      "accessibility_status": "UNKNOWN",
      "asset_policy": "GEOMETRY_ONLY_UNTIL_LICENSE_REVIEW"
    },
    {
      "source_node": "103:5523",
      "source_component": "Misc.",
      "variant": "Sticky controls/Zoom",
      "classification": "REQUIRED",
      "width": 7,
      "height": 7,
      "source_geometry_status": "EXTRACTED_METADATA",
      "detail_status": "UNKNOWN",
      "interaction_status": "UNKNOWN",
      "accessibility_status": "UNKNOWN",
      "asset_policy": "GEOMETRY_ONLY_UNTIL_LICENSE_REVIEW"
    },
    {
      "source_node": "103:5522",
      "source_component": "Misc.",
      "variant": "Sticky controls/Close",
      "classification": "REQUIRED",
      "width": 7,
      "height": 7,
      "source_geometry_status": "EXTRACTED_METADATA",
      "detail_status": "UNKNOWN",
      "interaction_status": "UNKNOWN",
      "accessibility_status": "UNKNOWN",
      "asset_policy": "GEOMETRY_ONLY_UNTIL_LICENSE_REVIEW"
    },
    {
      "source_node": "103:5521",
      "source_component": "Misc.",
      "variant": "Sticky controls/Re-size",
      "classification": "REQUIRED",
      "width": 8,
      "height": 8,
      "source_geometry_status": "EXTRACTED_METADATA",
      "detail_status": "UNKNOWN",
      "interaction_status": "UNKNOWN",
      "accessibility_status": "UNKNOWN",
      "asset_policy": "GEOMETRY_ONLY_UNTIL_LICENSE_REVIEW"
    },
    {